{
  "$schema": "https://json-schema.org/draft/2020-12/schema",
  "$id": "https://uvu.edu/schemas/lecture.schema.json",
  "title": "CS 3540 Lecture Document",
  "type": "object",
  "required": ["schema_version", "id", "week", "track", "title", "source", "slides"],
  "additionalProperties": false,
  "properties": {
    "schema_version": { "const": "1.0.0" },
    "id": { "type": "string", "pattern": "^[a-z0-9-]+$" },
    "course": { "type": "string" },
    "year": { "type": "integer" },
    "week": { "type": "integer", "minimum": 1, "maximum": 16 },
    "track": { "enum": ["game", "ai"] },
    "title": { "type": "string", "minLength": 1 },
    "subtitle": { "type": "string" },
    "source": {
      "type": "object",
      "required": ["deck", "script_hash"],
      "additionalProperties": false,
      "properties": {
        "deck": { "type": "string" },
        "script_hash": { "type": "string", "pattern": "^sha256:[0-9a-f]{64}$" }
      }
    },
    "audio": {
      "oneOf": [
        { "type": "null" },
        {
          "type": "object",
          "required": ["key", "duration_ms", "voice", "model", "script_hash", "generated_at"],
          "additionalProperties": false,
          "properties": {
            "key": { "type": "string" },
            "duration_ms": { "type": "integer", "minimum": 0 },
            "voice": { "type": "string" },
            "model": { "type": "string" },
            "script_hash": { "type": "string", "pattern": "^sha256:[0-9a-f]{64}$" },
            "generated_at": { "type": "string", "format": "date-time" }
          }
        }
      ]
    },
    "video": {
      "type": "object",
      "additionalProperties": false,
      "properties": {
        "intro": { "$ref": "#/$defs/video" },
        "outro": { "$ref": "#/$defs/video" }
      }
    },
    "slides": { "type": "array", "minItems": 1, "items": { "$ref": "#/$defs/slide" } }
  },
  "$defs": {
    "link": {
      "type": "object",
      "required": ["text", "url"],
      "additionalProperties": false,
      "properties": {
        "text": { "type": "string", "minLength": 1 },
        "url": { "type": "string", "pattern": "^https?://" }
      }
    },
    "video": {
      "oneOf": [
        { "type": "null" },
        {
          "type": "object",
          "required": ["key", "mode", "audio", "duration_ms"],
          "additionalProperties": false,
          "properties": {
            "key": { "type": "string" },
            "mode": { "enum": ["pip", "fullscreen"] },
            "audio": { "enum": ["video", "narration"] },
            "position": { "enum": ["top-left", "top-right", "bottom-left", "bottom-right"] },
            "duration_ms": { "type": "integer", "minimum": 0 }
          }
        }
      ]
    },
    "slide": {
      "type": "object",
      "required": ["index", "blocks", "script"],
      "additionalProperties": false,
      "properties": {
        "index": { "type": "integer", "minimum": 1 },
        "heading": { "type": "string" },
        "blocks": { "type": "array", "items": { "$ref": "#/$defs/block" } },
        "script": { "type": "string" },
        "links": { "type": "array", "items": { "$ref": "#/$defs/link" } },
        "audio_span": {
          "type": "object",
          "required": ["start_ms", "end_ms"],
          "additionalProperties": false,
          "properties": {
            "start_ms": { "type": "integer", "minimum": 0 },
            "end_ms": { "type": "integer", "minimum": 0 }
          }
        },
        "reveals": {
          "type": "array",
          "items": {
            "type": "object",
            "required": ["block", "at_ms"],
            "additionalProperties": false,
            "properties": {
              "block": { "type": "integer", "minimum": 0 },
              "at_ms": { "type": "integer", "minimum": 0 }
            }
          }
        },
        "video": { "$ref": "#/$defs/video" }
      }
    },
    "block": {
      "oneOf": [
        {
          "type": "object",
          "required": ["type", "text"],
          "additionalProperties": false,
          "properties": {
            "type": { "enum": ["title", "subtitle", "quote", "para"] },
            "text": { "type": "string" }
          }
        },
        {
          "type": "object",
          "required": ["type", "items"],
          "additionalProperties": false,
          "properties": {
            "type": { "const": "bullets" },
            "items": {
              "type": "array",
              "items": {
                "type": "object",
                "required": ["depth", "text"],
                "additionalProperties": false,
                "properties": {
                  "depth": { "type": "integer", "minimum": 0, "maximum": 1 },
                  "text": { "type": "string" }
                }
              }
            }
          }
        },
        {
          "type": "object",
          "required": ["type", "lang", "lines"],
          "additionalProperties": false,
          "properties": {
            "type": { "const": "code" },
            "lang": { "type": "string" },
            "lines": { "type": "array", "items": { "type": "string" } }
          }
        },
        {
          "type": "object",
          "required": ["type", "src"],
          "additionalProperties": false,
          "properties": {
            "type": { "const": "image" },
            "src": { "type": "string" }
          }
        }
      ]
    }
  }
}
